#
# Loading default ProxySQL configuration
#
SELECT COUNT(*) FROM runtime_mysql_servers;
COUNT(*)
0
SELECT COUNT(*) FROM runtime_mysql_users;
COUNT(*)
0
SELECT COUNT(*) FROM runtime_proxysql_servers;
COUNT(*)
0
SELECT COUNT(*) FROM runtime_mysql_query_rules;
COUNT(*)
0
SELECT COUNT(*) FROM scheduler;
COUNT(*)
0
UPDATE global_variables SET Variable_Value='8.0.22' WHERE Variable_name='mysql-server_version';
UPDATE global_variables SET Variable_Value='utf8' WHERE Variable_name='mysql-default_charset';
CREATE USER 'monitor'@'%' IDENTIFIED BY 'monitor';
GRANT ALL ON *.* TO 'monitor'@'%';
CREATE USER 'app_test'@'%' IDENTIFIED WITH 'mysql_native_password' BY 'test';
GRANT ALL ON *.* TO 'app_test'@'%';
INSERT INTO MYSQL_USERS (username,password,active,default_hostgroup,default_schema,transaction_persistent,comment) VALUES ('app_test','test',1,100,'mysql',1,'application test user DC1');
INSERT INTO mysql_query_rules (rule_id,proxy_port,username,destination_hostgroup,active,retries,match_digest,apply) VALUES(1040,6033,'app_test',100,1,3,'^SELECT.*FOR UPDATE',1);
INSERT INTO mysql_query_rules (rule_id,proxy_port,username,destination_hostgroup,active,retries,match_digest,apply) VALUES(1042,6033,'app_test',101,1,3,'^SELECT.*$',1);
#
# Applying ProxySQL configuration
#
INSERT INTO mysql_servers (hostname,hostgroup_id,port,weight,max_connections,comment) VALUES ('127.0.0.1',100,13000,10000,1000,'WRITE');
INSERT INTO mysql_servers (hostname,hostgroup_id,port,weight,max_connections,comment) VALUES ('127.0.0.1',101,13000,100,1000,'READ/WRITE');
INSERT INTO mysql_servers (hostname,hostgroup_id,port,weight,max_connections,comment) VALUES ('127.0.0.1',101,13006,10000,1000,'READ');
INSERT INTO mysql_servers (hostname,hostgroup_id,port,weight,max_connections,comment) VALUES ('127.0.0.1',101,13012,10000,1000,'READ');
INSERT INTO mysql_servers (hostname,hostgroup_id,port,weight,max_connections,comment) VALUES ('127.0.0.1',8100,13006,1000,1000,'Backup writer 1');
INSERT INTO mysql_servers (hostname,hostgroup_id,port,weight,max_connections,comment) VALUES ('127.0.0.1',8100,13012,10000,999,'Backup writer 2');
INSERT INTO scheduler (id,active,interval_ms,filename,arg1) values (10,1,3000,"SCHEDULER_SCRIPT","-u=admin -p=admin -h=127.0.0.1 -H=100:W,101:R -P=6032 --debug=1 --active_failover=1 --retry_down=2 --writer_is_also_reader=0 --log=MYSQL_TMP_DIR/galera_check-perl.log");
#
# Applying ProxySQL configuration
#
CREATE TABLE t1 (a int primary key);
INSERT INTO t1 VALUES (1), (2), (3);
SET global pxc_maint_mode=MAINTENANCE;
INSERT INTO t1 VALUES (11), (12), (13);
node_1 -> maintenance, node_3 -> writer
SELECT * FROM runtime_mysql_servers WHERE port=13000 ORDER BY hostgroup_id;
hostgroup_id	hostname	port	gtid_port	status	weight	compression	max_connections	max_replication_lag	use_ssl	max_latency_ms	comment
100	127.0.0.1	13000	0	OFFLINE_SOFT	10000	0	1000	0	0	0	WRITE100_W_101_R_retry_up=0;100_W_101_R_retry_down=0;
101	127.0.0.1	13000	0	OFFLINE_SOFT	100	0	1000	0	0	0	READ/WRITE100_W_101_R_retry_up=0;100_W_101_R_retry_down=0;
SELECT * FROM runtime_mysql_servers WHERE port=13012 ORDER BY hostgroup_id;
hostgroup_id	hostname	port	gtid_port	status	weight	compression	max_connections	max_replication_lag	use_ssl	max_latency_ms	comment
100	127.0.0.1	13012	0	ONLINE	10000	0	999	0	0	0	
8100	127.0.0.1	13012	0	ONLINE	10000	0	999	0	0	0	Backup writer 2
SELECT * FROM t1 ORDER BY a ASC;
a
1
2
3
11
12
13
SET global pxc_maint_mode=DISABLED;
INSERT INTO t1 VALUES (21), (22), (23);
node_1 -> back from maintenance to reader, node_3 -> still writer
SELECT * FROM runtime_mysql_servers WHERE port=13000 ORDER BY hostgroup_id;;
hostgroup_id	hostname	port	gtid_port	status	weight	compression	max_connections	max_replication_lag	use_ssl	max_latency_ms	comment
101	127.0.0.1	13000	0	ONLINE	100	0	1000	0	0	0	READ/WRITE100_W_101_R_retry_up=0;100_W_101_R_retry_down=0;
SELECT * FROM runtime_mysql_servers WHERE port=13012 ORDER BY hostgroup_id;;
hostgroup_id	hostname	port	gtid_port	status	weight	compression	max_connections	max_replication_lag	use_ssl	max_latency_ms	comment
100	127.0.0.1	13012	0	ONLINE	10000	0	999	0	0	0	
8100	127.0.0.1	13012	0	ONLINE	10000	0	999	0	0	0	Backup writer 2
SELECT * FROM t1 ORDER BY a ASC;
a
1
2
3
11
12
13
21
22
23
#
# Loading default ProxySQL configuration
#
SELECT COUNT(*) FROM runtime_mysql_servers;
COUNT(*)
0
SELECT COUNT(*) FROM runtime_mysql_users;
COUNT(*)
0
SELECT COUNT(*) FROM runtime_proxysql_servers;
COUNT(*)
0
SELECT COUNT(*) FROM runtime_mysql_query_rules;
COUNT(*)
0
SELECT COUNT(*) FROM scheduler;
COUNT(*)
0
SET global pxc_maint_mode=DISABLED;
DROP TABLE t1;
DROP USER 'monitor'@'%';
DROP USER 'app_test'@'%';
